Beberapa Ulasan Tiktok Shop,,,
,,,
Tanggal,Nama,Rating,Ulasan
2025-12-27,Tita Juwita,1,Tiktok shopnya tiba-tiba hilang. Saya jadi gak bisa pesan online untuk keluarga di rumah
2025-10-18,Opang Huu,1,Tiktok shop sangat berat dan tidak ada perbaikan
2026-02-25,Ni'ma K.,2,Kenapa yah aplikasi tiktok saya tidak muncul keranjang di menunya?
2025-11-27,Rafie Rafie,3,"Masya Allah, ternyata Tik Tok adalah salah satu sarana media sosial dunia maya serba guna, bisa untuk dijadikan fasilitas bisnis, bagian dari salah satu lapangan kerja, bisnis dagang online, dll"
2025-12-26,Nelia Assis,4,Sangat bagus dan berkualitas
2025-12-20,Rejo,5,Sangat berguna sekali untuk beli barang-barang online karena disini sangat detail kualitas barang dan produknya bagus
2025-11-10,Edi Saswano,5,"Tiktok ini sangat bagus, bisa membantu dalam berbagai bidang usaha"
2025-09-28,Marwati Smi,5,Alhamdulilah semenjak saya punya akun Tiktok saya merasa puas banget berbelanja atau lihat-lihat yang lainnya